{"api_version":"forge.device-fabric-activation-request/v1","canonicalization":"forgeos.canonical-json/v1","request_id":"synthetic-observe-review","review_context":"synthetic_review","requested_mode":"observe","production_authorization":false,"decisions":{"adr_0039":{"status":"accepted","acceptance_id":"synthetic-adr-0039-review","accepted_at_unix_ms":1700000000000,"planning_only":false},"adr_0113":{"status":"accepted","acceptance_id":"synthetic-adr-0113-review","accepted_at_unix_ms":1700000000001,"planning_only":false},"adr_0114":{"status":"accepted","acceptance_id":"synthetic-adr-0114-review","accepted_at_unix_ms":1700000000002,"planning_only":false}},"evidence":{"coordinator_owner_isolation":{"status":"verified","artifact_refs":["forge-core/internal/appserver"],"reviewer_refs":["role:security-reviewer"],"independent_review":true},"device_identity_proof":{"status":"verified","artifact_refs":["forge-core/internal/deviceidentity"],"reviewer_refs":["role:security-reviewer"],"independent_review":true},"owner_approval_and_revocation":{"status":"verified","artifact_refs":["docs/adr/ADR-0114-opt-in-device-enrollment-and-inventory-v1.md"],"reviewer_refs":["role:security-reviewer"],"independent_review":true},"heartbeat_cas_and_freshness":{"status":"verified","artifact_refs":["forge-core/internal/deviceheartbeat"],"reviewer_refs":["role:product-control-plane"],"independent_review":true},"inventory_owner_scope":{"status":"verified","artifact_refs":["forge-core/internal/deviceinventory"],"reviewer_refs":["role:product-control-plane"],"independent_review":true},"disabled_default_and_route_close":{"status":"verified","artifact_refs":["forge-core/internal/appserver/config.go"],"reviewer_refs":["role:security-reviewer"],"independent_review":true},"security_review":{"status":"verified","artifact_refs":["docs/adr/ADR-0114-opt-in-device-enrollment-and-inventory-v1.md"],"reviewer_refs":["role:security-reviewer"],"independent_review":true}},"authority":{"opens_listener":false,"registers_devices":false,"persists_inventory":false,"selects_placement":false,"reserves_resources":false,"dispatches_tasks":false,"executes_remote_work":false}}