{"api_version":"forge.device-fabric-activation-request/v1","canonicalization":"forgeos.canonical-json/v1","request_id":"repository-adr-0114-proposed-review","review_context":"repository_snapshot","requested_mode":"observe","production_authorization":false,"decisions":{"adr_0039":{"status":"accepted","acceptance_id":null,"accepted_at_unix_ms":null,"planning_only":true},"adr_0113":{"status":"proposed","acceptance_id":null,"accepted_at_unix_ms":null,"planning_only":false},"adr_0114":{"status":"proposed","acceptance_id":null,"accepted_at_unix_ms":null,"planning_only":false}},"evidence":{"coordinator_owner_isolation":{"status":"candidate","artifact_refs":["forge-core/internal/appserver"],"reviewer_refs":["role:security-reviewer"],"independent_review":false},"device_identity_proof":{"status":"candidate","artifact_refs":["forge-core/internal/deviceidentity"],"reviewer_refs":["role:security-reviewer"],"independent_review":false},"owner_approval_and_revocation":{"status":"candidate","artifact_refs":["docs/adr/ADR-0114-opt-in-device-enrollment-and-inventory-v1.md"],"reviewer_refs":["role:security-reviewer"],"independent_review":false},"heartbeat_cas_and_freshness":{"status":"candidate","artifact_refs":["forge-core/internal/deviceheartbeat"],"reviewer_refs":["role:product-control-plane"],"independent_review":false},"inventory_owner_scope":{"status":"candidate","artifact_refs":["forge-core/internal/deviceinventory"],"reviewer_refs":["role:product-control-plane"],"independent_review":false},"disabled_default_and_route_close":{"status":"candidate","artifact_refs":["forge-core/internal/appserver/config.go"],"reviewer_refs":["role:security-reviewer"],"independent_review":false},"security_review":{"status":"candidate","artifact_refs":["docs/adr/ADR-0114-opt-in-device-enrollment-and-inventory-v1.md"],"reviewer_refs":["role:security-reviewer"],"independent_review":false}},"authority":{"opens_listener":false,"registers_devices":false,"persists_inventory":false,"selects_placement":false,"reserves_resources":false,"dispatches_tasks":false,"executes_remote_work":false}}